{
  "schema_version": 1,
  "protocol": "agent-pontifex.coordinator",
  "protocol_versions": { "min_major": 1, "max_major": 1 },
  "service": "coordinator",
  "implementation": "agent-pontifex-community",
  "capabilities": [
    "coordinator.jobs.cancel","coordinator.jobs.claim","coordinator.jobs.complete",
    "coordinator.jobs.create","coordinator.jobs.heartbeat",
    "coordinator.jobs.idempotency","coordinator.jobs.retry"
  ],
  "extensions": {}
}
